{
  "schema_version": 1,
  "family": "radiation",
  "suite": "skinner_ostriker",
  "name": "streaming_front",
  "regime": "free-streaming periodic discontinuous front",
  "dimensionality": 3,
  "resolution_levels": [2, 3, 4],
  "build_type": "Release",
  "required_executable": "octotiger",
  "parameters": {"config": "radiation_results/configs/streaming_front.ini"},
  "expected_diagnostics": ["L1", "L2", "Linf", "radiation_conservation", "final_slice"],
  "reference_data": {
    "kind": "analytic",
    "owner": "octotiger/test_problems/radiation/profiles.hpp",
    "description": "Exact advected periodic square pulse with overlap-integrated cell averages"
  },
  "tolerance_policy": {
    "mode": "convergence",
    "owner": "Octo-TIGER radiation CTest definitions",
    "description": "Orders are reported by norm; a discontinuity is not assigned a smooth-solution order."
  },
  "visualization_products": ["field_maps", "line_profiles", "convergence", "conservation", "movie"],
  "adapter": {"name": "radiation_results", "case": "streaming_front"}
}
