{
  "schema_version": 1,
  "family": "radiation",
  "suite": "skinner_ostriker",
  "name": "gaussian_pulse",
  "regime": "scattering diffusion-limit Gaussian pulse",
  "dimensionality": 3,
  "resolution_levels": [2, 3, 4],
  "build_type": "Release",
  "required_executable": "octotiger",
  "parameters": {"config": "radiation_results/configs/gaussian_pulse.ini"},
  "expected_diagnostics": ["L1", "L2", "Linf", "radiation_conservation", "final_slice"],
  "reference_data": {
    "kind": "analytic",
    "owner": "radiation_results/cpp/gen_radiation_reference.cpp",
    "description": "Generated periodic linearized telegraph solution in OTRAD001 format"
  },
  "tolerance_policy": {
    "mode": "convergence",
    "owner": "Octo-TIGER radiation CTest definitions",
    "description": "Report numerical error separately from nonlinear model error in the linearized reference."
  },
  "visualization_products": ["field_maps", "line_profiles", "convergence", "conservation", "movie"],
  "adapter": {"name": "radiation_results", "case": "gaussian_pulse"}
}
