{
  "schema_version": 1,
  "family": "radiation",
  "suite": "ensman",
  "name": "equilibrium_sphere",
  "regime": "reference-dependent grey benchmark; conditional",
  "dimensionality": 3,
  "resolution_levels": [
    0,
    1,
    2
  ],
  "build_type": "Release",
  "required_executable": "octotiger",
  "parameters": {
    "units": "CGS",
    "availability": "conditional",
    "reason": "The identity and physical definition of the requested Ensman equilibrium sphere remain unverified. Published radiating-sphere examples and the existing Gaussian bulb are not substituted; see doc/ensman-reference-followup.md.",
    "domain_cm": null,
    "final_time_s": null,
    "initial_condition": null,
    "opacity": null,
    "boundary": null
  },
  "expected_diagnostics": [
    "reference_agreement",
    "convergence",
    "conservation",
    "positivity"
  ],
  "reference_data": {
    "kind": "published",
    "owner": "Ensman reference definition requires verification",
    "description": "Ensman (1994) bibliographic identity is known, but its full sphere definition/reference was not recovered. The independently located FLASH radiating sphere is a different published setup, not evidence that it is the requested Ensman case.",
    "documentation": "doc/ensman-reference-followup.md",
    "original_reference": "https://doi.org/10.1086/173889",
    "original_full_text_verified": false,
    "numerical_reference_available": false
  },
  "tolerance_policy": {
    "mode": "qualitative",
    "owner": "unassigned pending verified reference",
    "description": "Cannot pass without verified definition/reference; no invented tolerance"
  },
  "visualization_products": [
    "profiles",
    "movie"
  ],
  "adapter": {
    "name": "conditional",
    "case": "equilibrium_sphere"
  }
}
