{
  "schema_version": 1,
  "family": "radiation",
  "suite": "diagnostics",
  "name": "streaming_wave_pc",
  "regime": "piecewise-constant reconstruction isolation; F=cE",
  "dimensionality": 1,
  "resolution_levels": [
    0,
    1,
    2
  ],
  "build_type": "Release",
  "required_executable": "compiled production-method fixture",
  "parameters": {
    "units": "CGS",
    "length_cm": 60000000000.0,
    "domain_cm": [
      [
        -30000000000.0,
        30000000000.0
      ],
      [
        -30000000000.0,
        30000000000.0
      ],
      [
        -30000000000.0,
        30000000000.0
      ]
    ],
    "final_time_s": 0.5003461427972281,
    "c_cm_s": 29979245800.0,
    "chi_cm_inverse": 0,
    "amplitude": 0.2,
    "width_cm": 6000000000.0,
    "velocity_cm_s": 0,
    "reduced_light_speed_ratio": 1,
    "rho_g_cm3": 1e-10,
    "gas_internal_erg_cm3": 1,
    "radiation_energy_erg_cm3": 1,
    "frames": 9,
    "boundary": "periodic",
    "reconstruction": "piecewise_constant",
    "resolution": "N=8*2^level in each direction; effective one-dimensional data",
    "initial_condition": "exact cell averages; formula in native_suite.reference",
    "opacity": {
      "model": "grey",
      "units": "1/cm",
      "absorption": 0,
      "scattering": 0,
      "transport_absorption": -1
    },
    "hard_dt": "thermal: final_time/(8*N); otherwise production CFL; subcycle test gas_dt<=4*rad_limit",
    "output_cadence_s": 0.06254326784965351,
    "energy_mode": "equilibrium",
    "radiation_options": {
      "cfl": 0.4,
      "source_theta": 1,
      "subcycling": true,
      "max_subcycles": 1024,
      "velocity_terms": false,
      "reduced_light_speed_ratio": 1
    },
    "material_fixture": {
      "gamma": 1.6666666666666667,
      "mean_molecular_weight": 1,
      "hydro_evolution": false,
      "unit_conversion_factors": [
        1,
        1,
        1
      ]
    }
  },
  "expected_diagnostics": [
    "L1",
    "L2",
    "Linf",
    "positivity",
    "reduced_flux",
    "conservation",
    "convergence",
    "boundary_epochs"
  ],
  "reference_data": {
    "kind": "analytic",
    "owner": "verification_results/adapters/native_suite.py",
    "description": "Analytic or independent ODE reference; diagnostic variant, not a substituted published benchmark",
    "source": "derived moment-equation solution",
    "publication_equivalence": "No published numerical curve claimed"
  },
  "tolerance_policy": {
    "mode": "convergence",
    "owner": "Step 05 analytical accuracy policy",
    "description": "First-order spatial isolation uses its exact discrete Fourier prediction, not the PLM continuum error envelope. See Step 05 criterion correction note.",
    "min_order": 0.65,
    "l1_coefficient": 2,
    "conservation_relative": 2e-11,
    "realizability_tolerance": 2e-12,
    "convergence_required": true,
    "accuracy_rule": "Independent constant-reconstruction VL Fourier amplification, max residual <= 5e-12 erg/cm^3; continuum norms and first-order convergence still reported"
  },
  "visualization_products": [
    "profiles",
    "signed_error",
    "convergence",
    "movie"
  ],
  "adapter": {
    "name": "native_suite",
    "case": "streaming_wave_pc"
  }
}
